{
  "service_name": "Payment Onboarding Service",
  "methodology": "STRIDE + PASTA-style scoring + attack-chain mapping + compensating-controls assessment",
  "date": "2026-07-13",
  "status": "Draft",
  "sources_summary": ["Jira PROJ-4210 (epic)", "Jenkins onboarding-service pipeline", "ServiceNow CHG0043211", "GitHub org/onboarding-service"],
  "executive_summary": "The Payment Onboarding Service ingests customer KYC applications, screens them against a third-party sanctions API, and persists records to a dedicated data store. Nine threats were identified across all six STRIDE categories; two are rated High risk and form the basis of a single plausible attack chain that could result in unauthorized approval of a sanctioned applicant. One compliance control (outbound PII transfer logging) was found partially compliant.",
  "scope": "In scope: API Gateway, Onboarding Service, KYC Data Store, Sanctions Screening integration, and the Jenkins deployment pipeline for onboarding-service. Out of scope: downstream ledger posting.",
  "sources": {
    "jira": [{"ref": "PROJ-4210", "description": "Epic: KYC onboarding v2"}],
    "jenkins": [{"ref": "onboarding-service #482", "description": "Last successful deploy to prod"}],
    "servicenow": [{"ref": "CHG0043211", "description": "Change request for sanctions API integration"}],
    "repo": [{"ref": "org/onboarding-service@main", "description": "Source repo, auth middleware reviewed"}]
  },
  "actors_components": [
    {"name": "Customer", "type": "External Actor", "description": "Submits KYC application via web form"},
    {"name": "API Gateway", "type": "Process", "description": "AuthN + rate limiting"},
    {"name": "Onboarding Service", "type": "Process", "description": "Validates and persists KYC data"},
    {"name": "KYC Data Store", "type": "Data Store", "description": "Stores PII and uploaded documents"},
    {"name": "Sanctions Screening (3rd party)", "type": "External System", "description": "Outbound PII transfer for screening"},
    {"name": "Jenkins CI/CD", "type": "Process", "description": "Deploys onboarding-service"}
  ],
  "trust_boundaries": [
    {"boundary": "External <-> Internal", "flows_crossing": "1", "description": "Untrusted customer traffic entering the API Gateway"},
    {"boundary": "Internal <-> Third Party", "flows_crossing": "4", "description": "Outbound PII to sanctions screening vendor"},
    {"boundary": "CI/CD <-> Production", "flows_crossing": "5", "description": "Deployment pipeline pushing code into production"}
  ],
  "data_flows": [
    {"num": 1, "source": "Customer", "destination": "API Gateway", "data_action": "Submit application", "protocol": "HTTPS REST", "threats": ["S-1", "E-1"]},
    {"num": 2, "source": "API Gateway", "destination": "Onboarding Service", "data_action": "Forward validated request", "protocol": "Internal gRPC", "threats": ["T-1"]},
    {"num": 3, "source": "Onboarding Service", "destination": "KYC Data Store", "data_action": "Persist KYC record", "protocol": "Internal TLS", "threats": ["I-1"]},
    {"num": 4, "source": "Onboarding Service", "destination": "Sanctions Screening", "data_action": "Screen applicant", "protocol": "HTTPS REST", "threats": ["I-2", "R-1"]},
    {"num": 5, "source": "Jenkins CI/CD", "destination": "Onboarding Service", "data_action": "Deploy build", "protocol": "SSH deploy", "threats": ["T-2"]}
  ],
  "threats": [
    {"id": "S-1", "category": "Spoofing", "title": "Session token replay", "description": "Captured session tokens can be replayed from a different device due to missing device-binding.", "affected_flow": "Flow 1", "threat_actor": "Unauthenticated external attacker", "likelihood": 4, "impact": 5, "score": 20, "risk_bucket": "High", "impact_rationale": "Full KYC PII exposure, cross-tenant reach", "existing_controls": "Session tokens expire after 15 minutes", "probability_of_mitigation": "85% - device binding is a well-understood pattern", "residual_risk": "6 (Medium)", "additional_controls_required": ["Bind session to device fingerprint", "Add anomaly detection for geographically impossible logins"], "mitigation": "Implement device-bound session tokens with short TTL", "owner_action": "Fix before next release"},
    {"id": "E-1", "category": "Elevation of Privilege", "title": "Parameter tampering on applicant status", "description": "Client-controlled status parameter could allow an applicant to self-approve.", "affected_flow": "Flow 1", "threat_actor": "Unauthenticated external attacker", "likelihood": 3, "impact": 5, "score": 15, "risk_bucket": "High", "impact_rationale": "Would allow sanctioned applicant approval - regulatory exposure", "existing_controls": "Server-side validation exists but does not cover all status transitions", "probability_of_mitigation": "90% - server-side state machine is standard", "residual_risk": "4 (Low)", "additional_controls_required": ["Enforce status transitions via a server-side state machine", "Add integration test for illegal transitions"], "mitigation": "Move status transition logic fully server-side with a strict state machine", "owner_action": "Fix before next release"},
    {"id": "T-1", "category": "Tampering", "title": "Unsigned internal gRPC payload", "description": "Internal gRPC calls between gateway and onboarding service are not signed, allowing tampering by a compromised sidecar.", "affected_flow": "Flow 2", "threat_actor": "Compromised internal service", "likelihood": 2, "impact": 4, "score": 8, "risk_bucket": "Medium", "impact_rationale": "Partial PII tampering, single-service blast radius", "existing_controls": "mTLS between services", "probability_of_mitigation": "80% - message signing is standard", "residual_risk": "4 (Low)", "additional_controls_required": ["Add message-level signing in addition to transport mTLS"], "mitigation": "Add HMAC signing to internal gRPC payloads", "owner_action": "Backlog"},
    {"id": "I-1", "category": "Information Disclosure", "title": "Unencrypted document field at rest", "description": "One document attachment field in the KYC data store is stored without column-level encryption.", "affected_flow": "Flow 3", "threat_actor": "Insider with DB access", "likelihood": 2, "impact": 5, "score": 10, "risk_bucket": "Medium", "impact_rationale": "Full document exposure if DB is compromised or misconfigured", "existing_controls": "Disk-level encryption at rest, DB access is IAM-gated", "probability_of_mitigation": "85% - column-level encryption is well solved", "residual_risk": "4 (Low)", "additional_controls_required": ["Apply column-level encryption to document fields", "Rotate KMS keys quarterly"], "mitigation": "Encrypt document fields at the application layer before write", "owner_action": "Fix before next release"},
    {"id": "I-2", "category": "Information Disclosure", "title": "PII sent to sanctions vendor without field minimization", "description": "Full applicant record is sent to the third-party sanctions API instead of only the fields needed for screening.", "affected_flow": "Flow 4", "threat_actor": "Third-party vendor compromise", "likelihood": 3, "impact": 4, "score": 12, "risk_bucket": "Medium", "impact_rationale": "Partial PII exposure if vendor is breached; vendor risk not fully in our control", "existing_controls": "Vendor has signed a DPA", "probability_of_mitigation": "60% - depends on vendor API supporting field-level requests", "residual_risk": "6 (Medium)", "additional_controls_required": ["Data minimization: send only name/DOB/nationality", "Vendor security review cadence"], "mitigation": "Minimize fields sent to third-party screening API", "owner_action": "Fix before next release"},
    {"id": "R-1", "category": "Repudiation", "title": "No immutable audit log of screening decisions", "description": "Screening pass/fail decisions are not written to an append-only audit log, making it hard to prove a decision was made correctly after the fact.", "affected_flow": "Flow 4", "threat_actor": "Insider / auditor dispute", "likelihood": 3, "impact": 4, "score": 12, "risk_bucket": "Medium", "impact_rationale": "Compliance/audit exposure - cannot demonstrate correct screening for regulator", "existing_controls": "Standard application logs exist but are mutable and not access-controlled", "probability_of_mitigation": "80% - append-only audit logging is standard", "residual_risk": "4 (Low)", "additional_controls_required": ["Write screening decisions to a WORM/append-only audit store"], "mitigation": "Add append-only audit logging for all screening decisions", "owner_action": "Fix before next release"},
    {"id": "D-1", "category": "Denial of Service", "title": "No rate limit on application submission", "description": "The application submission endpoint has no per-IP or per-account rate limit, allowing a flood of submissions to exhaust review capacity.", "affected_flow": "Flow 1", "threat_actor": "Unauthenticated external attacker / botnet", "likelihood": 4, "impact": 3, "score": 12, "risk_bucket": "Medium", "impact_rationale": "Availability impact on manual review queue, no direct data exposure", "existing_controls": "API Gateway has a global rate limit, not per-account", "probability_of_mitigation": "85% - per-account rate limiting is standard", "residual_risk": "4 (Low)", "additional_controls_required": ["Add per-account and per-IP rate limiting", "CAPTCHA on repeated failures"], "mitigation": "Implement per-account rate limiting at the gateway", "owner_action": "Backlog"},